{
  "$id": "https://developer-portfolio/interests-data-schema.json",
  "$schema": "http://json-schema.org/draft-07/schema#",
  "title": "Developer Portfolio Site Interests Data",
  "description": "Define the interests of the developer.",
  "type": "array",
  "minItems": 1,
  "maxItems": 99,
  "uniqueItems": true,
  "additionalProperties": false,
  "items": {
    "type": "object",
    "additionalProperties": false,
    "required": ["id", "title", "imagePath", "description"],
    "properties": {
      "_classMap": {
        "description": "Spring Data deserializer class for the simple-service.",
        "type": "string",
        "maxLength": 64
      },
      "_classSQL": {
        "description": "Spring Data deserializer class for the sql-service.",
        "type": "string",
        "maxLength": 64
      },
      "id": {
        "description": "A number to identify the individual interest.",
        "type": "integer"
      },
      "title": {
        "description": "A brief description of the interest.",
        "type": "string",
        "minLength": 4,
        "maxLength": 64
      },
      "imagePath": {
        "description": "Path to an image for this interest.",
        "type": "string",
        "maxLength": 2048
      },
      "description": {
        "description": "A more detailed description of the interest.",
        "type": "string",
        "maxLength": 512
      }
    }
  }
}
